{
  "id": "db.autoload_off",
  "schema_version": 1,
  "title": "Stop loading known-safe options on every request",
  "category": "database",
  "kind": "data",
  "risk": "low",
  "base_confidence": 0.9,
  "reversible": true,
  "destructive": false,
  "handler": "Debloater\\Apply\\DataOperations\\AutoloadReview",
  "params": {
    "prefixes": {
      "type": "array",
      "items": {
        "type": "string",
        "pattern": "^[A-Za-z0-9_\\-]{3,64}$"
      },
      "default": [
        "_transient_timeout_",
        "_site_transient_timeout_",
        "_wc_session_",
        "elementor_remote_info_",
        "rank_math_",
        "litespeed.admin_display."
      ],
      "description": "Option name prefixes eligible to stop autoloading. Values given here can only narrow the operation's own allowlist, never widen it."
    },
    "minimum_bytes": {
      "type": "integer",
      "minimum": 256,
      "maximum": 1048576,
      "default": 4096,
      "description": "Only options at least this large are worth changing."
    }
  },
  "description": "Marks a small set of known-safe options so WordPress stops loading them into memory on every single request. Nothing is deleted and no value changes; only the flag that decides whether an option is read eagerly. Options outside the allowlist are never touched, however large they are.",
  "breaks": [],
  "requires": [],
  "conflicts": [],
  "conditions": [],
  "measurements": [
    "db.autoload_bytes"
  ],
  "probes": [
    "home",
    "admin"
  ],
  "since_wp": "2.0",
  "docs_url": null
}
